{
  "base": "base_value_23",
  "dep0": "dep0_value_1",
  "dep1": "dep1_value_70",
  "dep14": "dep14_value_16",
  "dep15": "dep15_value_56",
  "dep17": "dep17_value_12",
  "dep18": "dep18_value_12",
  "dep22": "dep22_value_4",
  "dep23": "dep23_value_68",
  "dep27": "dep27_value_35",
  "dep28": "dep28_value_100",
  "dep29": "dep29_value_36",
  "dep3": "dep3_value_4",
  "dep31": "dep31_value_7",
  "dep6": "dep6_value_54",
  "dep7": "dep7_value_69",
  "dep8": "dep8_value_87",
  "field0": "field0_value_31",
  "field1": "field1_value_44",
  "field14": "field14_value_33",
  "field15": "field15_value_4",
  "field17": "field17_value_78",
  "field18": "field18_value_96",
  "field22": "field22_value_13",
  "field23": "field23_value_25",
  "field27": "field27_value_78",
  "field28": "field28_value_71",
  "field29": "field29_value_63",
  "field3": "field3_value_30",
  "field31": "field31_value_44",
  "field6": "field6_value_10",
  "field7": "field7_value_15",
  "field8": "field8_value_53"
}
